{
  "schema": 1,
  "id": "menus.v3.metadata",
  "title": "GET /menus/v3/metadata answers {restaurantGuid, lastUpdated}, and lastUpdated is the value the full menu document carries",
  "source": {
    "url": "https://doc.toasttab.com/toast-api-specifications/toast-menus-api-v3.yaml",
    "fetched": "2026-09-02",
    "provenance": "documented",
    "note": "The Metadata schema has restaurantGuid and lastUpdated, the latter marking the newest publish timestamp of the menu data, meant as the signal callers poll to decide whether to pull a fresh copy -- the same definition Restaurant.lastUpdated carries, which is why the second step asserts the captured value against the full document. That equality is inferred from the two identical definitions; no sentence states it. apiMenusV3.html answered 403 to every fetch this session."
  },
  "routes": ["GET /menus/v3/metadata", "GET /menus/v3/menus"],
  "profile": "full",
  "steps": [
    {
      "name": "metadata",
      "request": {"method": "GET", "path": "/menus/v3/metadata", "headers": {"$auth": "restaurant"}},
      "expect": {
        "status": 200,
        "headers": {"content-type": "application/json"},
        "body": {"restaurantGuid": "e6a4a8d2-0000-4000-8000-000000000001", "lastUpdated": "${re:\\d{4}-\\d{2}-\\d{2}T\\d{2}:\\d{2}:\\d{2}\\.\\d{3}\\+0000}"},
        "absent": ["/menus"]
      },
      "capture": {"last_updated": "/lastUpdated"}
    },
    {
      "name": "menus-agree",
      "request": {"method": "GET", "path": "/menus/v3/menus", "headers": {"$auth": "restaurant"}},
      "expect": {
        "status": 200,
        "body": {"restaurantGuid": "e6a4a8d2-0000-4000-8000-000000000001", "lastUpdated": "${cap.last_updated}"}
      }
    }
  ]
}
